<?xml version="1.0" encoding="utf-8" ?>
<!DOCTYPE mail PUBLIC "-//TC-DM3//DTD MAIL//EN" "mail.dtd">

<mail>
    <from email="${commonParameters.fromEmail}" name="${commonParameters.fromEmailName}" />
    <recipients>
        <to email="${inputForm.email}" name="" />
    </recipients>
    <replyTo email="${commonParameters.replyToEmail}" />
    <errorTo email="${commonParameters.errorToEmail}" />

    <subject>新規パスワード発行完了のお知らせ</subject>

    <!-- Text body -->
    <body>
<![CDATA[

================================================================
新規パスワード発行完了のお知らせ
================================================================

$!{commonParameters.panasonicReSmail}管理画面において、新規パスワードの発行が
完了いたしました。

────────────────────────────────

■新パスワード
$!{inputForm.password}


◇管理システムへのログイン
$!{commonParameters.adminLoginUrl}

────────────────────────────────

以上、よろしくお願いいたします。


※本メールは送信専用メールアドレスから配信されています。
ご返信いただいてもお答えできませんのでご了承ください。

━━━━━━━━━━━━━━━━━━━━━━━━━━━━━━━━
$!{commonParameters.panasonicReSmailAffairs}
問い合わせ先ナビダイヤル：$!{commonParameters.reSmailTel}
（受付時間　$!{commonParameters.reSmailUktskJkn}）
----------------------------------------------------------------
$!{commonParameters.panasonicReSmail}
$!{commonParameters.reSmailUrl}
━━━━━━━━━━━━━━━━━━━━━━━━━━━━━━━━


]]>
    </body>

</mail>