<?xml version="1.0" encoding="utf-8" ?>
<!DOCTYPE mail PUBLIC "-//TC-DM3//DTD MAIL//EN" "mail.dtd">

<mail>
    <from email="${commonParameters.fromEmail}" name="${commonParameters.fromEmailName}" />
    <recipients>
        <to email="${email}" name="" />
        <bcc email="${commonParameters.bccEmail}" />
    </recipients>
 	<replyTo email="${commonParameters.replyToEmail}" />
    <errorTo email="${commonParameters.errorToEmail}"/>

    <subject>物件リクエスト登録内容変更のお知らせ[$!{housingRequestForm.housingRequestId}]</subject>

    <!-- Text body -->
    <body>
<![CDATA[

$!{commonParameters.panasonicReSmail}より、物件リクエストの登録内容を変更いただいたお客様に自動送信されています。

＝＝＝＝＝＝＝＝＝＝＝＝＝＝＝＝＝＝＝＝＝＝＝＝＝＝＝＝＝＝＝＝
物件リクエスト　ご登録内容変更完了のお知らせ
＝＝＝＝＝＝＝＝＝＝＝＝＝＝＝＝＝＝＝＝＝＝＝＝＝＝＝＝＝＝＝＝

$!{commonParameters.panasonicReSmail}をご利用いただきありがとうございます。

物件リクエストにご登録いただいている内容が変更されました。
本メールは、お客様の控えとして保管してください。
ご要望に合致する、または近い物件が見つかり次第、不動産会社担当者よりご連絡いたします。
また　ご要望内容に関して、ReaRie担当者より確認のご連絡をさせて頂く場合がございますので、ご承知おきの程宜しく御願い致します。

──変更いただいた物件リクエスト条件──────────────

■物件リクエスト番号
$!{housingRequestForm.housingRequestId}

■物件種別
$!{housingKindName}

■物件所在地
［都道府県］$!{prefName}
［市区町村］$!{addressName}
［沿線］ $!{rootName} $!{stationName}

■基本条件
［予算］$!{priceLower}${priceFromTo}$!{priceUpper}
［建物面積］$!{buildingAreaLower}${buildingFromTo}$!{buildingAreaUpper}
［土地面積］$!{landAreaLower}${landFromTo}$!{landAreaUpper}

◇物件リクエストの登録条件はマイページより確認・変更・削除いただけます。
${mypagePath}

────────────────────────────────

※本メールにお心当たりのないお客様は、お手数ですが下記までご連絡ください。
※本メールは送信専用メールアドレスから配信されています。
ご返信いただいてもお答えできませんのでご了承ください。

━━━━━━━━━━━━━━━━━━━━━━━━━━━━━━━━
$!{commonParameters.panasonicReSmailAffairs}
問い合わせ先ナビダイヤル：${commonParameters.reSmailTel}
（受付時間　${commonParameters.reSmailUktskJkn}）
----------------------------------------------------------------
$!{commonParameters.panasonicReSmail}
${commonParameters.reSmailUrl}
━━━━━━━━━━━━━━━━━━━━━━━━━━━━━━━━
]]>
    </body>

</mail>