<?xml version="1.0" encoding="utf-8" ?>
<!DOCTYPE mail PUBLIC "-//TC-DM3//DTD MAIL//EN" "mail.dtd">

<mail>
    <from email="${commonParameters.fromEmail}" name="${commonParameters.fromEmailName}" />
    <recipients>
        <to email="${inputForm.email}" name="" />
        <bcc email="${loginUserEmail}" />
    </recipients>
    <replyTo email="${commonParameters.replyToEmail}" />
    <errorTo email="${commonParameters.errorToEmail}"/>

    <subject>【お知らせ更新】$!{inputForm.title}</subject>

    <!-- Text body -->
    <body>
<![CDATA[

${commonParameters.panasonicReSmail}より、会員登録をされているお客様へのお知らせです。

＝＝＝＝＝＝＝＝＝＝＝＝＝＝＝＝＝＝＝＝＝＝＝＝＝＝＝＝＝＝＝＝
お客様へのお知らせ
＝＝＝＝＝＝＝＝＝＝＝＝＝＝＝＝＝＝＝＝＝＝＝＝＝＝＝＝＝＝＝＝

${commonParameters.panasonicReSmail}をご利用いただきありがとうございます。

お客様へのお知らせが更新されました。
詳細はマイページよりご確認いただけます。

────────────────────────────────

■お知らせ件名
$!{inputForm.title}

以下のURLからお知らせの詳細をご確認ください。
${commonParameters.siteURL}/mypage/information/$!{inputForm.informationNo}/


◇その他のお知らせはマイページよりご確認ください。
${commonParameters.mypageLoginUrl}

────────────────────────────────


※本メールにお心当たりのないお客様は、お手数ですが下記までご連絡ください。
※本メールは送信専用メールアドレスから配信されています。
ご返信いただいてもお答えできませんのでご了承ください。

━━━━━━━━━━━━━━━━━━━━━━━━━━━━━━━━
${commonParameters.panasonicReSmailAffairs}
問い合わせ先ナビダイヤル：$!{commonParameters.reSmailTel}
（受付時間　${commonParameters.reSmailUktskJkn}）
------------------------------------------------------------------------
${commonParameters.panasonicReSmail}
$!{commonParameters.reSmailUrl}
━━━━━━━━━━━━━━━━━━━━━━━━━━━━━━━━

]]>
    </body>

</mail>