<?xml version="1.0" encoding="utf-8" ?>
<!DOCTYPE mail PUBLIC "-//TC-DM3//DTD MAIL//EN" "mail.dtd">

<mail>
    <from email="${commonParameters.fromEmail}" name="${commonParameters.fromEmailName}" />
    <recipients>
        <to email="${inputForm.email}" name="" />
        <bcc email="${commonParameters.bccEmail}" />
    </recipients>
    <replyTo email="${commonParameters.replyToEmail}" />
    <errorTo email="${commonParameters.errorToEmail}"/>

    <subject>事務局より新規会員登録完了のお知らせ</subject>

    <!-- Text body -->
    <body>
<![CDATA[

$!{commonParameters.panasonicReSmail}より、新規会員登録いただいたお客様に自動送信されています。

＝＝＝＝＝＝＝＝＝＝＝＝＝＝＝＝＝＝＝＝＝＝＝＝＝＝＝＝＝＝＝＝＝＝＝＝
 　　　　　　新規会員登録完了のお知らせ
＝＝＝＝＝＝＝＝＝＝＝＝＝＝＝＝＝＝＝＝＝＝＝＝＝＝＝＝＝＝＝＝＝＝＝＝

$!{commonParameters.panasonicReSmail}をご利用いただきありがとうございます。

会員登録いただき、ありがとうございました。
お申し込みいただいた内容を元に、事務局にて手続きが完了いたしました。
ご登録内容はマイページよりご確認いただけます。

────────────────────────────────────

■パスワード
$!{inputForm.password}

■マイページログイン画面
$!{commonParameters.mypageLoginUrl}

※本メールが届いているメールアドレスと、上記に記載のパスワードでログインしてください。
※お名前、ご住所等の個人情報は、個人情報保護のため本メールには記載しておりません。

────────────────────────────────────

※本メールにお心当たりのないお客様は、お手数ですが下記までご連絡ください。
※本メールは送信専用メールアドレスから配信されています。
　ご返信いただいてもお答えできませんのでご了承ください。

━━━━━━━━━━━━━━━━━━━━━━━━━━━━━━━━━━━━
$!{commonParameters.panasonicReSmailAffairs}
問い合わせ先ナビダイヤル：$!{commonParameters.reSmailTel}
（受付時間　$!{commonParameters.reSmailUktskJkn}）
------------------------------------------------------------------------
$!{commonParameters.panasonicReSmail}
 $!{commonParameters.reSmailUrl}
━━━━━━━━━━━━━━━━━━━━━━━━━━━━━━━━━━━━


]]>
    </body>

</mail>