<?xml version="1.0" encoding="utf-8" ?>
<!DOCTYPE mail PUBLIC "-//TC-DM3//DTD MAIL//EN" "mail.dtd">

<mail>
    <from email="${commonParameters.fromEmail}" name="${commonParameters.fromEmailName}" />
    <recipients>
        <to email="${inputForm.email}" name="" />
    </recipients>
    <replyTo email="${commonParameters.replyToEmail}" />
    <errorTo email="${commonParameters.errorToEmail}"/>

    <subject>パスワード再設定画面のご連絡</subject>

    <!-- Text body -->
    <body>
<![CDATA[

$!{commonParameters.panasonicReSmail}より、パスワードの再設定を希望されたお客様に自動送信されています。

＝＝＝＝＝＝＝＝＝＝＝＝＝＝＝＝＝＝＝＝＝＝＝＝＝＝＝＝＝＝＝＝
パスワード再設定のご連絡
＝＝＝＝＝＝＝＝＝＝＝＝＝＝＝＝＝＝＝＝＝＝＝＝＝＝＝＝＝＝＝＝

$!{commonParameters.panasonicReSmail}をご利用いただきありがとうございます。

下記のリンクより、新しいパスワードをご登録ください。

────────────────────────────────

■パスワード再設定用URL
$!{mailUrl}

※このリンクの有効期間は、URL発行時より24時間となります。
有効期間を過ぎてしまった場合には、恐れ入りますが再度「パスワードのお問い合わせ」よりお手続きください。

────────────────────────────────

※本メールにお心当たりのないお客様は、お手数ですが下記までご連絡ください。
※本メールは送信専用メールアドレスから配信されています。
ご返信いただいてもお答えできませんのでご了承ください。

━━━━━━━━━━━━━━━━━━━━━━━━━━━━━━━━
$!{commonParameters.panasonicReSmailAffairs}
問い合わせ先ナビダイヤル：${commonParameters.reSmailTel}
（受付時間　${commonParameters.reSmailUktskJkn}）
----------------------------------------------------------------
$!{commonParameters.panasonicReSmail}
${commonParameters.reSmailUrl}
━━━━━━━━━━━━━━━━━━━━━━━━━━━━━━━━

]]>
    </body>

</mail>