<?xml version="1.0" encoding="utf-8" ?>
<!DOCTYPE mail PUBLIC "-//TC-DM3//DTD MAIL//EN" "mail.dtd">

<mail>
    <from email="${commonParameters.fromEmail}" name="${commonParameters.fromEmailName}" />
    <recipients>
        <to email="${inputForm.email}" name="" />
    </recipients>
    <replyTo email="${commonParameters.replyToEmail}" />
    <errorTo email="${commonParameters.errorToEmail}"/>

    <subject>【重要】パスワード再設定完了のお知らせ</subject>

    <!-- Text body -->
    <body>
<![CDATA[

$!{commonParameters.panasonicReSmail}より、パスワードの再設定をされたお客様に自動送信されています。

＝＝＝＝＝＝＝＝＝＝＝＝＝＝＝＝＝＝＝＝＝＝＝＝＝＝＝＝＝＝＝＝
【重要】パスワード再設定完了のお知らせ
＝＝＝＝＝＝＝＝＝＝＝＝＝＝＝＝＝＝＝＝＝＝＝＝＝＝＝＝＝＝＝＝

$!{commonParameters.panasonicReSmail}をご利用いただきありがとうございます。

パスワードの再設定が完了いたしました。
下記よりマイページにログインいただけます。

────────────────────────────────

■マイページログイン画面
${mypageURL}

────────────────────────────────

引き続き、$!{commonParameters.panasonicReSmail}をどうぞよろしくお願いいたします。

※本メールにお心当たりのないお客様は、お手数ですが下記までご連絡ください。
※本メールは送信専用メールアドレスから配信されています。
ご返信いただいてもお答えできませんのでご了承ください。

━━━━━━━━━━━━━━━━━━━━━━━━━━━━━━━━
$!{commonParameters.panasonicReSmailAffairs}
問い合わせ先ナビダイヤル：${commonParameters.reSmailTel}
（受付時間　${commonParameters.reSmailUktskJkn}）
----------------------------------------------------------------
$!{commonParameters.panasonicReSmail}
${commonParameters.reSmailUrl}
━━━━━━━━━━━━━━━━━━━━━━━━━━━━━━━━


]]>
    </body>

</mail>