<?xml version="1.0" encoding="utf-8" ?>
<!DOCTYPE mail PUBLIC "-//TC-DM3//DTD MAIL//EN" "mail.dtd">

<mail>
    <from email="${commonParameters.fromEmail}" name="${commonParameters.fromEmailName}" />
    <recipients>
        <to email="${inputForm.getInquiryHeaderForm().email}" name="" />
        <bcc email="${commonParameters.bccEmail}" />
    </recipients>
    <replyTo email="${commonParameters.replyToEmail}" />
    <errorTo email="${commonParameters.errorToEmail}"/>

    <subject>物件お問い合わせ内容の控え[$!{inputForm.inquiryId}]</subject>

    <!-- Text body -->
    <body>
<![CDATA[

$!{commonParameters.panasonicReSmail}より、物件のお問い合わせをいただいたお客様に自動送信されています。

＝＝＝＝＝＝＝＝＝＝＝＝＝＝＝＝＝＝＝＝＝＝＝＝＝＝＝＝＝＝＝＝＝＝＝＝
物件のお問い合わせ内容の控え
＝＝＝＝＝＝＝＝＝＝＝＝＝＝＝＝＝＝＝＝＝＝＝＝＝＝＝＝＝＝＝＝＝＝＝＝

$!{commonParameters.panasonicReSmail}をご利用いただきありがとうございます。

物件のお問い合わせをいただきありがとうございました。
本メールは、お客様の控えとして保管してください。
また　ご要望内容に関して、ReaRie担当者より確認のご連絡をさせて頂く場合がございますので、ご承知おきの程宜しく御願い致します。

──お問い合わせ内容──────────────────────────

■お問い合わせ番号
$!{inputForm.inquiryId}

■お問い合わせ物件
［物 件 番 号］ $!{inputForm.housingCd}

■お問い合わせ内容
［お問い合わせ内容］ $!{inputForm.inquiryDtlTypeMail}
［お問い合わせ内容詳細］ $!{inputForm.getInquiryHeaderForm().inquiryText}

※お名前、ご住所等の個人情報は、個人情報保護のため本メールには記載しておりません。

────────────────────────────────────

※本メールにお心当たりのないお客様は、お手数ですが下記までご連絡ください。
※本メールは送信専用メールアドレスから配信されています。
ご返信いただいてもお答えできませんのでご了承ください。

━━━━━━━━━━━━━━━━━━━━━━━━━━━━━━━━━━━━
$!{commonParameters.panasonicReSmailAffairs}
問い合わせ先ナビダイヤル：$!{commonParameters.reSmailTel}
（受付時間　$!{commonParameters.reSmailUktskJkn}）
------------------------------------------------------------------------
$!{commonParameters.panasonicReSmail}
$!{commonParameters.reSmailUrl}
━━━━━━━━━━━━━━━━━━━━━━━━━━━━━━━━━━━━

]]>
    </body>

</mail>